{
  "id": "turkey-creek-trailhead-night",
  "slug": "turkey-creek-trailhead-night",
  "destinationId": "sedona",
  "name": "Turkey Creek trailhead",
  "lat": 34.803,
  "lon": -111.857,
  "elevationM": 1250,
  "siteType": "trailhead",
  "publicAccess": "limited",
  "accessScore": 68,
  "active": true,
  "priority": 86,
  "certificationIds": [],
  "notesSourceUrl": "https://www.fs.usda.gov/recarea/coconino/recarea/?recid=55330",
  "accessNotes": {
    "en": "Use only the published visitor arrangement for Turkey Creek trailhead. Confirm current access, parking or booking, hours and hazard notices before travel; the coordinate is not permission to enter or camp.",
    "de": "Nutze nur die veröffentlichte Besucherregelung für Turkey Creek trailhead. Bestätige aktuellen Zugang, Parken oder Buchung, Zeiten und Gefahrenmeldungen vor der Reise; die Koordinate ist keine Zutritts- oder Campingerlaubnis."
  }
}
