{
  "id": "gallo-campground",
  "slug": "gallo-campground",
  "destinationId": "chaco-culture",
  "name": "Gallo Campground",
  "lat": 36.044,
  "lon": -107.922,
  "elevationM": 1890,
  "siteType": "campground",
  "publicAccess": "limited",
  "accessScore": 78,
  "active": true,
  "priority": 93,
  "certificationIds": [],
  "notesSourceUrl": "https://www.nps.gov/chcu/planyourvisit/nightsky.htm",
  "accessNotes": {
    "en": "Use only the current published visitor arrangement for Gallo Campground. Confirm parking, booking, opening, hazards and the return before travel; this coordinate is not permission to enter or camp.",
    "de": "Nutze für Gallo Campground nur die aktuell veröffentlichte Besucherregelung. Bestätige Parken, Buchung, Öffnung, Gefahren und Rückkehr vor der Fahrt; diese Koordinate ist keine Zutritts- oder Campingerlaubnis."
  }
}
