{
  "id": "puna-posta-hornillos-guided-observation",
  "slug": "puna-posta-hornillos-guided-observation",
  "destinationId": "puna-argentina",
  "name": "Posta de Hornillos guided observation stop",
  "lat": -23.6546204,
  "lon": -65.4314311,
  "elevationM": 2368,
  "siteType": "event-venue",
  "publicAccess": "limited",
  "accessScore": 68,
  "active": true,
  "priority": 90,
  "certificationIds": [],
  "notesSourceUrl": "https://trensolar.com.ar/cielo-en-movimiento/",
  "accessNotes": {
    "en": "The official Cielo en Movimiento itinerary names Posta de Hornillos as the 21:05 observing stop, with guided astronomy through professional telescopes followed by dinner. This coordinate identifies the mapped historic Posta, but it does not grant independent access. Use it only inside a dated Cielo en Movimiento booking, arrive with the included operator itinerary and leave with the scheduled return; do not drive to the site or remain after the group departs.",
    "de": "Der offizielle Ablauf von Cielo en Movimiento nennt die Posta de Hornillos als Beobachtungshalt um 21:05 Uhr, mit geführter Astronomie an professionellen Teleskopen und anschließendem Abendessen. Diese Koordinate bezeichnet die kartierte historische Posta, gewährt aber keinen selbstständigen Zugang. Nutze sie ausschließlich im Rahmen einer datierten Cielo-en-Movimiento-Buchung, komme mit dem enthaltenen Betreiberablauf an und fahre mit der vorgesehenen Rückfahrt ab; fahre den Ort nicht selbstständig an und bleibe nicht nach Abfahrt der Gruppe."
  }
}
