{
  "id": "westhavelland-core",
  "slug": "westhavelland-core",
  "destinationId": "westhavelland",
  "name": "Westhavelland dark-sky core",
  "lat": 52.72,
  "lon": 12.28,
  "elevationM": 45,
  "siteType": "plain",
  "publicAccess": "yes",
  "accessScore": 88,
  "active": true,
  "priority": 90,
  "certificationIds": []
}
