{
  "id": "sark-dachinger-observatory",
  "slug": "sark-dachinger-observatory",
  "destinationId": "isle-of-sark",
  "name": "Dachinger Observatory",
  "lat": 49.432552,
  "lon": -2.361605,
  "elevationM": 104,
  "siteType": "public-observatory",
  "publicAccess": "limited",
  "accessScore": 68,
  "active": true,
  "priority": 86,
  "certificationIds": [],
  "notesSourceUrl": "https://www.sark.co.uk/nature/dark-skies",
  "accessNotes": {
    "en": "Sark's official visitor service directs visitors to contact the Visitor Centre to book the island observatory, while its current community page says the Sark Astronomy Society offers telescope sessions at the Dachinger Observatory throughout the year for a minimum donation. Use this exact observatory only after the Visitor Centre or Society confirms a dated session and meeting instructions. Walk the public lanes carefully, carry a low red light and do not infer access to neighbouring land outside the guided programme.",
    "de": "Der offizielle Besucherdienst von Sark verweist für Buchungen des Inselobservatoriums an das Visitor Centre; die aktuelle Gemeinschaftsseite erklärt zudem, dass die Sark Astronomy Society ganzjährig Teleskopsitzungen am Dachinger Observatory gegen eine Mindestspende anbietet. Nutze dieses genau verortete Observatorium nur nach Bestätigung eines datierten Termins und der Treffpunktanweisung durch Visitor Centre oder Society. Gehe vorsichtig auf den öffentlichen Wegen, nutze schwaches rotes Licht und leite aus dem Programm keinen Zutritt zu benachbartem Gelände ab."
  }
}
