{
  "id": "zselic-starry-sky",
  "slug": "zselic-starry-sky",
  "destinationId": "zselic",
  "name": "Zselic Starry Sky Park",
  "lat": 46.23,
  "lon": 17.82,
  "elevationM": 200,
  "siteType": "forest",
  "publicAccess": "yes",
  "accessScore": 82,
  "active": true,
  "priority": 75,
  "certificationIds": []
}
