{
  "id": "sani-pass-border",
  "slug": "sani-pass-border",
  "destinationId": "sani-pass",
  "name": "Sani Mountain Escape lodge guest property",
  "lat": -29.584577,
  "lon": 29.288123,
  "elevationM": 2878,
  "siteType": "booked-mountain-lodge",
  "publicAccess": "unknown",
  "accessScore": null,
  "active": true,
  "priority": 87,
  "certificationIds": [],
  "notesSourceUrl": "https://sanimountain.co.za/lesotho-accommodation/",
  "accessNotes": {
    "en": "Sani Mountain Escape currently offers bookable overnight accommodation at 2,874 m; this representative lodge point is published by a regional accommodation directory, not supplied by the operator as an astronomy pin. Every visit requires a confirmed booking. The point is within the managed guest property and is not permission to walk onto the pass, trails or surrounding highland after dark. Ask the operator which immediate area is allowed for after-dark viewing, and follow its weather, border, vehicle, wildlife and lighting instructions. This catalogue entry is a planning reference, not confirmation of public night access. Before booking or travel, contact the named operator or responsible authority yourself for the exact place, date, hours, access route, parking and return plan. If they do not confirm it, do not use this pin.",
    "de": "Sani Mountain Escape bietet aktuell buchbare Übernachtungen auf 2.874 m; diesen repräsentativen Lodge-Punkt veröffentlicht ein regionales Unterkunftsverzeichnis, nicht der Betreiber als Astronomiepunkt. Jeder Besuch erfordert eine bestätigte Buchung. Der Punkt liegt innerhalb der betreuten Gästefläche und erlaubt nicht, nachts auf den Pass, Wege oder das umliegende Hochland zu gehen. Frage den Betreiber, welche unmittelbare Fläche nach Einbruch der Dunkelheit genutzt werden darf, und befolge Wetter-, Grenz-, Fahrzeug-, Wildtier- und Lichtregeln. Dieser Katalogeintrag ist eine Planungsreferenz und keine Bestätigung eines öffentlichen Nachtzugangs. Kontaktiere vor Buchung oder Anreise selbst den genannten Betreiber oder die zuständige Behörde und kläre den genauen Ort, das Datum, die Zeiten, Zufahrt, Parken und Rückkehr. Ohne konkrete Bestätigung darfst du diesen Pin nicht nutzen."
  }
}
