{
  "id": "jebel-akhdar-anantara-dianas-point-guest-platform",
  "slug": "jebel-akhdar-anantara-dianas-point-guest-platform",
  "destinationId": "jebel-akhdar",
  "name": "Anantara Diana's Point guest platform",
  "lat": 23.067681116038536,
  "lon": 57.67011780953533,
  "elevationM": 1970,
  "siteType": "resort-guest-platform",
  "publicAccess": "limited",
  "accessScore": 54,
  "active": true,
  "priority": 86,
  "certificationIds": [],
  "notesSourceUrl": "https://www.anantara.com/uploads/minor/anantara/documents/anantaraaljabal-al-akhdar-resort/anantara-al-jabal-discovery-guide.pdf",
  "accessNotes": {
    "en": "Anantara's official discovery guide promotes stargazing and the Diana's Point resort setting; the published coordinate identifies the resort arrival area, not the exact cliff-edge platform or public parking. Use the platform only as an overnight guest after staff confirms that evening's permitted guest area, safety boundary and equipment rules; a room reservation alone does not establish Environment Authority entry or overnight permission. The resort requires a 4x4 and checkpoint documents or a prearranged operator transfer. Its separate astronomer activity is a distinct operator arrangement and is not this catalogue point. Do not enter the cliff edge without staff approval, camp, make fires or drive between resorts after dark.",
    "de": "Anantaras offizieller Discovery Guide bewirbt Sternbeobachtung und die Resort-Umgebung von Diana's Point; die veröffentlichte Koordinate bezeichnet den Resort-Check-in, nicht die genaue Plattform an der Felskante oder einen öffentlichen Parkplatz. Nutze die Plattform nur als Übernachtungsgast, nachdem das Personal die für diesen Abend erlaubte Gästefläche, Sicherheitsgrenze und Ausrüstungsregeln bestätigt hat; eine Zimmerbuchung belegt keine Einreise- oder Übernachtungsgenehmigung der Umweltbehörde. Das Resort verlangt Allradfahrzeug und Checkpoint-Dokumente oder einen vorab vereinbarten Betreibertransfer. Die separate Astronomenaktivität ist ein eigenes Betreiberangebot und nicht dieser Katalogpunkt. Betritt die Felskante nicht ohne Personalfreigabe, campe nicht, entfache kein Feuer und fahre nachts nicht zwischen Resorts."
  }
}
