{
  "id": "vogelsang-star-observatory",
  "slug": "vogelsang-star-observatory",
  "destinationId": "eifel",
  "name": "Vogelsang star observatory",
  "lat": 50.596,
  "lon": 6.447,
  "elevationM": 520,
  "siteType": "public-observatory",
  "publicAccess": "limited",
  "accessScore": 78,
  "active": true,
  "priority": 90,
  "certificationIds": [],
  "notesSourceUrl": "https://www.nationalpark-eifel.de/de-simple/nationalpark-erleben/sternenpark/",
  "accessNotes": {
    "en": "Public observing at Vogelsang is offered through scheduled events and depends on clear weather. Park at Walberhof, remain on marked routes, and do not camp in the national park.",
    "de": "Öffentliche Beobachtung in Vogelsang findet bei klarem Wetter im Rahmen terminierter Veranstaltungen statt. Parke am Walberhof, bleibe auf markierten Wegen und campe nicht im Nationalpark."
  }
}
