{
  "id": "llyn-y-dywarchen",
  "slug": "llyn-y-dywarchen",
  "destinationId": "eryri",
  "name": "Llyn y Dywarchen",
  "lat": 53.074,
  "lon": -4.146,
  "elevationM": 250,
  "siteType": "lake-viewpoint",
  "publicAccess": "yes",
  "accessScore": 78,
  "active": true,
  "priority": 84,
  "certificationIds": [],
  "notesSourceUrl": "https://snowdonia.gov.wales/discover/dark-skies/",
  "accessNotes": {
    "en": "Use only the published visitor arrangement for Llyn y Dywarchen. Confirm current access, parking or booking, hours and hazard notices before travel; the coordinate is not permission to enter or camp.",
    "de": "Nutze nur die veröffentlichte Besucherregelung für Llyn y Dywarchen. Bestätige aktuellen Zugang, Parken oder Buchung, Zeiten und Gefahrenmeldungen vor der Reise; die Koordinate ist keine Zutritts- oder Campingerlaubnis."
  }
}
