{
  "id": "bwlch-y-groes-dark-sky",
  "slug": "bwlch-y-groes-dark-sky",
  "destinationId": "eryri",
  "name": "Bwlch y Groes",
  "lat": 52.715,
  "lon": -3.582,
  "elevationM": 545,
  "siteType": "mountain-pass",
  "publicAccess": "limited",
  "accessScore": 60,
  "active": true,
  "priority": 84,
  "certificationIds": [],
  "notesSourceUrl": "https://snowdonia.gov.wales/discover/dark-skies/",
  "accessNotes": {
    "en": "Use only the published visitor arrangement for Bwlch y Groes. Confirm current access, parking or booking, hours and hazard notices before travel; the coordinate is not permission to enter or camp.",
    "de": "Nutze nur die veröffentlichte Besucherregelung für Bwlch y Groes. Bestätige aktuellen Zugang, Parken oder Buchung, Zeiten und Gefahrenmeldungen vor der Reise; die Koordinate ist keine Zutritts- oder Campingerlaubnis."
  }
}
