{
  "id": "khuri-village-camp-zone",
  "slug": "khuri-village-camp-zone",
  "destinationId": "jaisalmer",
  "name": "Khuri village camp zone",
  "lat": 26.619,
  "lon": 70.723,
  "elevationM": 230,
  "siteType": "desert-village",
  "publicAccess": "limited",
  "accessScore": 64,
  "active": true,
  "priority": 85,
  "certificationIds": [],
  "notesSourceUrl": "https://www.incredibleindia.gov.in/en/rajasthan/jaisalmer",
  "accessNotes": {
    "en": "Use only the published visitor arrangement for Khuri village camp zone. Confirm current access, parking or booking, hours and hazard notices before travel; the coordinate is not permission to enter or camp.",
    "de": "Nutze nur die veröffentlichte Besucherregelung für Khuri village camp zone. Bestätige aktuellen Zugang, Parken oder Buchung, Zeiten und Gefahrenmeldungen vor der Reise; die Koordinate ist keine Zutritts- oder Campingerlaubnis."
  }
}
