{
  "id": "oracle-kannally-ranch-house-star-party",
  "slug": "oracle-kannally-ranch-house-star-party",
  "destinationId": "oracle-state-park",
  "name": "Kannally Ranch House star-party patio",
  "lat": 32.6096723,
  "lon": -110.7336317,
  "elevationM": 1326,
  "siteType": "programme-observing-patio",
  "publicAccess": "no",
  "accessScore": 0,
  "active": true,
  "priority": 78,
  "certificationIds": [],
  "notesSourceUrl": "https://azstateparks.com/oracle/events",
  "accessNotes": {
    "en": "Arizona State Parks identifies public Star Parties near Kannally Ranch House as its staffed night-sky option, and its official 2025 workshop documents the Ranch House living room and patio as the programme footprint. This is not an independent observing alternative. The current park calendar reviewed on 2026-09-22 lists no future astronomy event, so do not enter or set up here after normal closing. Use this record only when Arizona State Parks publishes a new dated Star Party or provides a written after-hours arrangement for the chosen night; follow that event's admission, parking, staff and finish instructions.",
    "de": "Arizona State Parks bezeichnet öffentliche Star Parties nahe dem Kannally Ranch House als betreute Nachthimmel-Option; der offizielle Workshop von 2025 belegt Wohnraum und Patio des Ranch House als Programmfläche. Dies ist keine selbstständige Beobachtungsalternative. Der am 22.09.2026 geprüfte Parkkalender nennt keinen künftigen Astronomietermin; betrete den Ort daher nach der normalen Schließzeit nicht und baue dort nichts auf. Nutze diesen Datensatz nur, wenn Arizona State Parks eine neue datierte Star Party veröffentlicht oder für die gewählte Nacht eine schriftliche Sonderregelung erteilt; befolge deren Eintritts-, Park-, Personal- und Abschlussanweisungen."
  }
}
